zone,crop,planting_month,planting_month_name,harvest_month,harvest_month_name,rainfall_reliability_score,phase,activity,start_week_offset,end_week_offset,approx_start_month,approx_end_month,approx_start_month_num,activity_notes
South West,Oil palm fruit,3,Mar,3,Mar,0.872,VEGETATIVE,Second year fertilizer,24,24,Sep,Sep,9,Full NPK per palm at year 2
South West,Oil palm fruit,3,Mar,3,Mar,0.872,REPRODUCTIVE,First bunch monitoring (yr 3+),36,52,Dec,Apr,12,Count bunches; thin excess in first bearing year
South West,Oil palm fruit,3,Mar,3,Mar,0.872,REPRODUCTIVE,Bunch harvest cycle begins,40,52,Jan,Apr,1,Harvest ripe bunches every 10–14 days
South West,Oil palm fruit,3,Mar,3,Mar,0.872,HARVEST,Ongoing bunch harvesting,40,52,Jan,Apr,1,Use harvesting chisel; harvest at black fruit threshold
South West,Oil palm fruit,3,Mar,3,Mar,0.872,POST_HARVEST,FFB transport and processing,40,52,Jan,Apr,1,Transport within 24hrs to avoid FFA rise
South West,Rice (paddy),4,Apr,9,Sep,0.872,PRE_PLANTING,Nursery bed preparation,-4,-4,Mar,Mar,3,Prepare raised nursery bed 1×10m per ha field
South West,Rice (paddy),4,Apr,9,Sep,0.872,PRE_PLANTING,Seed soaking and pregermination,-3,-3,Mar,Mar,3,Soak 24hr; drain 24hr; sow at pin-point germination
South West,Rice (paddy),4,Apr,9,Sep,0.872,PRE_PLANTING,Nursery seeding,-3,-2,Mar,Mar,3,Broadcast 40g/m² in nursery; flood to 2cm depth
South West,Rice (paddy),4,Apr,9,Sep,0.872,PRE_PLANTING,Land puddling and bund construction,-2,-1,Mar,Mar,3,Puddle field; form bunds to retain water
South West,Rice (paddy),4,Apr,9,Sep,0.872,PLANTING,Transplanting,0,1,Apr,Apr,4,Transplant 3-week-old seedlings; 2–3 per hill; 20×20cm
South West,Rice (paddy),4,Apr,9,Sep,0.872,EARLY_GROWTH,Flood management,1,3,Apr,Apr,4,Maintain 5cm flood depth; drain for weeding
South West,Rice (paddy),4,Apr,9,Sep,0.872,EARLY_GROWTH,First weeding (drain and hand-weed),2,3,Apr,Apr,4,Drain field; weed; re-flood within 24hrs
South West,Rice (paddy),4,Apr,9,Sep,0.872,VEGETATIVE,First fertilizer application (NPK),3,3,Apr,Apr,4,Apply before re-flooding; broadcast and flood
South West,Rice (paddy),4,Apr,9,Sep,0.872,VEGETATIVE,Pest scouting — stem borer and BPH,4,10,May,Jun,5,Scout twice weekly; avoid broad-spectrum at tillering
South West,Rice (paddy),4,Apr,9,Sep,0.872,VEGETATIVE,Second weeding or herbicide,5,6,May,May,5,Post-emergence herbicide or drain-and-hoe
South West,Rice (paddy),4,Apr,9,Sep,0.872,REPRODUCTIVE,Second fertilizer — Urea at panicle,8,8,Jun,Jun,6,Panicle initiation top-dress; drain 3 days before
South West,Rice (paddy),4,Apr,9,Sep,0.872,REPRODUCTIVE,Water management at flowering,9,11,Jun,Jun,6,Maintain 5cm flood; critical for pollination
South West,Rice (paddy),4,Apr,9,Sep,0.872,PRE_HARVEST,Drain field and maturity check,13,14,Jul,Jul,7,Drain 2 weeks before harvest; check grain moisture
South West,Rice (paddy),4,Apr,9,Sep,0.872,HARVEST,Harvesting and threshing,14,16,Jul,Aug,7,Harvest at <25% moisture; thresh within 24hrs
South West,Rice (paddy),4,Apr,9,Sep,0.872,POST_HARVEST,Drying and milling preparation,16,18,Aug,Aug,8,Sun-dry to <14%; bag for milling or storage
South West,Sorghum,3,Mar,8,Aug,0.872,PRE_PLANTING,Land clearing and tillage,-4,-3,Feb,Feb,2,Minimum tillage acceptable; remove previous stubble
South West,Sorghum,3,Mar,8,Aug,0.872,PRE_PLANTING,Input procurement,-2,-1,Feb,Feb,2,"Procure certified seed, NPK fertilizer"
South West,Sorghum,3,Mar,8,Aug,0.872,PLANTING,Sowing,0,0,Mar,Mar,3,Drill or spot sow; 75×20cm; thin to 1 plant at 2 WAP
South West,Sorghum,3,Mar,8,Aug,0.872,EARLY_GROWTH,Thinning and gap filling,2,3,Mar,Mar,3,Thin to 1 seedling/hole; fill gaps with reserve seed
South West,Sorghum,3,Mar,8,Aug,0.872,VEGETATIVE,"Pest scouting — shoot fly, aphids",2,10,Mar,May,3,Scout weekly; apply systemic insecticide at threshold
South West,Sorghum,3,Mar,8,Aug,0.872,EARLY_GROWTH,First weeding,3,5,Mar,Apr,3,Critical period; weed before 4 WAP
South West,Sorghum,3,Mar,8,Aug,0.872,VEGETATIVE,Fertilizer application,5,5,Apr,Apr,4,NPK at 5 WAP; side-dress; avoid waterlogging
South West,Sorghum,3,Mar,8,Aug,0.872,VEGETATIVE,Second weeding,7,8,Apr,May,4,Before panicle initiation
South West,Sorghum,3,Mar,8,Aug,0.872,REPRODUCTIVE,Bird scare implementation,14,18,Jun,Jul,6,Continuous bird-scaring from grain filling to harvest
South West,Sorghum,3,Mar,8,Aug,0.872,REPRODUCTIVE,Mould monitoring,15,20,Jun,Aug,6,Check for grain mould in high-humidity zones
South West,Sorghum,3,Mar,8,Aug,0.872,PRE_HARVEST,Maturity assessment,18,20,Jul,Aug,7,Panicle colour and grain hardness check
South West,Sorghum,3,Mar,8,Aug,0.872,HARVEST,Harvesting,20,21,Aug,Aug,8,Cut panicles; head by head; avoid shattering
South West,Sorghum,3,Mar,8,Aug,0.872,POST_HARVEST,Threshing and drying,21,22,Aug,Aug,8,Sun-dry to <12% moisture; bag in hermetic storage
South West,Yam,2,Feb,9,Sep,0.872,PRE_PLANTING,Mound construction,-4,-3,Jan,Jan,1,Form 1×1m mounds 30–50cm high before rains; labour-intensive
South West,Yam,2,Feb,9,Sep,0.872,PRE_PLANTING,Seed yam sett preparation,-3,-2,Jan,Jan,1,Cut setts 150–200g; dust with fungicide/ash; cure 7 days
South West,Yam,2,Feb,9,Sep,0.872,PRE_PLANTING,Staking material procurement,-2,-1,Jan,Jan,1,"Procure 5,000 stakes/ha; pre-plant before sowing"
South West,Yam,2,Feb,9,Sep,0.872,PLANTING,Planting seed yam setts,0,0,Feb,Feb,2,Plant on top of mound; 5cm depth; 1 sett/mound
South West,Yam,2,Feb,9,Sep,0.872,EARLY_GROWTH,Staking young vines,3,4,Feb,Mar,2,Stake vines at 3–4 WAP to prevent lodging
South West,Yam,2,Feb,9,Sep,0.872,EARLY_GROWTH,First weeding,3,5,Feb,Mar,2,Hand weed; avoid disturbing tuber zone
South West,Yam,2,Feb,9,Sep,0.872,VEGETATIVE,First fertilizer application,6,6,Mar,Mar,3,NPK 15:15:15 at 6 WAP; side-dress around mound
South West,Yam,2,Feb,9,Sep,0.872,VEGETATIVE,Pest scouting — yam mosaic virus,6,20,Mar,Jul,3,Scout weekly; rogue infected vines immediately
South West,Yam,2,Feb,9,Sep,0.872,VEGETATIVE,Second weeding,8,10,Apr,Apr,4,Critical for tuber bulking; avoid root disturbance
South West,Yam,2,Feb,9,Sep,0.872,VEGETATIVE,Second fertilizer application,10,10,Apr,Apr,4,Muriate of Potash for tuber quality
South West,Yam,2,Feb,9,Sep,0.872,REPRODUCTIVE,Tuber monitoring,20,28,Jul,Sep,7,Observe vine senescence; partial harvest possible
South West,Yam,2,Feb,9,Sep,0.872,PRE_HARVEST,Vine senescence assessment,26,28,Aug,Sep,8,80% vine dry-down indicates harvest readiness
South West,Yam,2,Feb,9,Sep,0.872,HARVEST,Harvesting and destaking,28,30,Sep,Sep,9,Manual dig; avoid cuts; destake before lifting
South West,Yam,2,Feb,9,Sep,0.872,POST_HARVEST,Barn storage or yam barn construction,30,32,Sep,Oct,9,Stack in shaded barn; inspect monthly for rot
